{
  "meta": {
    "artifact_name": "brand_compliance_post_generation_check",
    "artifact_version": "0.1.0",
    "brief_id": "brief_demo_action_camera_001",
    "product_name": "运动相机",
    "producer": "Brand Compliance Agent",
    "compliance_run_id": "brief_demo_action_camera_001::brand_compliance::post_generation_check::001",
    "mode": "post_generation_check",
    "trace_id": "brief_demo_action_camera_001::two_stage_compliance",
    "status": "needs_review",
    "execution_context": "retrospective_design_validation",
    "historical_execution_claimed": false
  },
  "inputs_used": [
    "docs/two_stage_compliance_spec.md",
    "prompts/brand_compliance_agent.md",
    "schemas/artifacts/two_stage_compliance_report.schema.json",
    "outputs/brand_compliance_pre_check.json",
    "outputs/creative_copy_pack_outline.json",
    "outputs/image_prompt_pack_outline.json",
    "outputs/selling_point_matrix.json",
    "outputs/platform_strategy_plan.json",
    "data/sample_brief.json"
  ],
  "decision_summary": {
    "decision": "needs_review",
    "summary": "结构化创意方案和结构化视觉方案可以进入 Human Approval Node，因为它们未生成最终营销文案、最终图片 Prompt 或图片，并保留了 proof waitlist、asset dependency map、forbidden elements 与人工审核要求；但所有 pre_check 风险仍未因正式证明、有效授权或明确删除而解决，且历史下游产物未使用新增 pre_check 的稳定 risk_id，存在 risk_traceability_gap。因此本次只允许进入人工审核，不允许最终生成、前端页面或公开发布。",
    "target_stage": "Human Approval Node",
    "next_stage_allowed": true,
    "human_review_required": true
  },
  "risk_records": [
    {
      "compliance_run_id": "brief_demo_action_camera_001::brand_compliance::post_generation_check::001",
      "mode": "post_generation_check",
      "trace_id": "brief_demo_action_camera_001::two_stage_compliance",
      "risk_id": "risk_brief_structure_complete_but_evidence_not_formal",
      "risk_type": "brief_completeness",
      "source_artifact": "outputs/brand_compliance_pre_check.json",
      "source_json_pointer": "/risk_records/0",
      "evidence_status": "verified",
      "severity": "minor",
      "decision": "approved",
      "revision_action": "结构化创意方案和结构化视觉方案均保留了“不生成最终文案/最终图片 Prompt/公开素材”的边界；但该 approved 只覆盖结构边界，不解除任何证明、授权或发布 gate。",
      "release_gate_effect": {
        "structured_planning_package": "needs_review",
        "growth_evaluation": "approved_for_evaluation_only",
        "final_marketing_copy": "blocked",
        "final_image_prompt": "blocked",
        "image_generation": "blocked",
        "frontend_page": "blocked",
        "public_release": "blocked"
      },
      "human_review_required": false,
      "post_generation_assessment": "下游产物是结构化方案，不是最终营销文案、最终图片 Prompt 或图片。"
    },
    {
      "compliance_run_id": "brief_demo_action_camera_001::brand_compliance::post_generation_check::001",
      "mode": "post_generation_check",
      "trace_id": "brief_demo_action_camera_001::two_stage_compliance",
      "risk_id": "risk_hd_360_image_quality_requires_formal_proof",
      "risk_type": "product_capability_claim",
      "source_artifact": "outputs/creative_copy_pack_outline.json",
      "source_json_pointer": "/data/claim_source_map/0",
      "evidence_status": "requires_human_verification",
      "severity": "major",
      "decision": "needs_review",
      "revision_action": "Creative Copy 与 Image Prompt 仍使用高清、360 度、沉浸视角等结构化卖点，并在 proof_waitlist 中等待高清样片、规格说明和导出示例；未见正式证明材料，不能标记为 resolved。",
      "release_gate_effect": {
        "structured_planning_package": "needs_review",
        "growth_evaluation": "approved_for_evaluation_only",
        "final_marketing_copy": "blocked",
        "final_image_prompt": "blocked",
        "image_generation": "blocked",
        "frontend_page": "blocked",
        "public_release": "blocked"
      },
      "human_review_required": true,
      "related_visual_pointer": "/data/visual_risk_register/1"
    },
    {
      "compliance_run_id": "brief_demo_action_camera_001::brand_compliance::post_generation_check::001",
      "mode": "post_generation_check",
      "trace_id": "brief_demo_action_camera_001::two_stage_compliance",
      "risk_id": "risk_stabilization_claim_requires_test_conditions",
      "risk_type": "product_capability_claim",
      "source_artifact": "outputs/creative_copy_pack_outline.json",
      "source_json_pointer": "/data/claim_source_map/1",
      "evidence_status": "requires_human_verification",
      "severity": "major",
      "decision": "needs_review",
      "revision_action": "结构化创意和视觉方案继续使用运动防抖、稳定记录、骑行/滑雪/跑步等场景；虽有 blocked expression 和 proof waitlist，但未见测试条件或正式样片，不能标记为 resolved。",
      "release_gate_effect": {
        "structured_planning_package": "needs_review",
        "growth_evaluation": "approved_for_evaluation_only",
        "final_marketing_copy": "blocked",
        "final_image_prompt": "blocked",
        "image_generation": "blocked",
        "frontend_page": "blocked",
        "public_release": "blocked"
      },
      "human_review_required": true,
      "related_visual_pointer": "/data/visual_risk_register/0"
    },
    {
      "compliance_run_id": "brief_demo_action_camera_001::brand_compliance::post_generation_check::001",
      "mode": "post_generation_check",
      "trace_id": "brief_demo_action_camera_001::two_stage_compliance",
      "risk_id": "risk_waterproof_durability_requires_rating_and_limits",
      "risk_type": "product_capability_claim",
      "source_artifact": "outputs/creative_copy_pack_outline.json",
      "source_json_pointer": "/data/claim_source_map/2",
      "evidence_status": "requires_human_verification",
      "severity": "critical",
      "decision": "needs_review",
      "revision_action": "裸机防水与耐用、雨天/海边/潜水/雪地、水上运动等风险继续存在；下游保留条件说明和 forbidden elements，但未提供防水等级、深度、时长、环境条件或耐用测试，不能标记为 resolved。",
      "release_gate_effect": {
        "structured_planning_package": "needs_review",
        "growth_evaluation": "approved_for_evaluation_only",
        "final_marketing_copy": "blocked",
        "final_image_prompt": "blocked",
        "image_generation": "blocked",
        "frontend_page": "blocked",
        "public_release": "blocked"
      },
      "human_review_required": true,
      "related_visual_pointer": "/data/visual_asset_structures/1/proof_materials_to_wait_for"
    },
    {
      "compliance_run_id": "brief_demo_action_camera_001::brand_compliance::post_generation_check::001",
      "mode": "post_generation_check",
      "trace_id": "brief_demo_action_camera_001::two_stage_compliance",
      "risk_id": "risk_ai_auto_editing_effect_requires_scope_limits",
      "risk_type": "product_capability_claim",
      "source_artifact": "outputs/creative_copy_pack_outline.json",
      "source_json_pointer": "/data/claim_source_map/3",
      "evidence_status": "requires_human_verification",
      "severity": "major",
      "decision": "needs_review",
      "revision_action": "AI 自动剪辑继续作为效率辅助卖点出现；下游明确禁止爆款和保证表现，但未提供功能范围、流程演示或可编辑步骤正式证明，不能标记为 resolved。",
      "release_gate_effect": {
        "structured_planning_package": "needs_review",
        "growth_evaluation": "approved_for_evaluation_only",
        "final_marketing_copy": "blocked",
        "final_image_prompt": "blocked",
        "image_generation": "blocked",
        "frontend_page": "blocked",
        "public_release": "blocked"
      },
      "human_review_required": true,
      "related_visual_pointer": "/data/visual_risk_register/2"
    },
    {
      "compliance_run_id": "brief_demo_action_camera_001::brand_compliance::post_generation_check::001",
      "mode": "post_generation_check",
      "trace_id": "brief_demo_action_camera_001::two_stage_compliance",
      "risk_id": "risk_required_product_app_scene_assets_need_authorization",
      "risk_type": "asset_authorization",
      "source_artifact": "outputs/image_prompt_pack_outline.json",
      "source_json_pointer": "/data/asset_dependency_map",
      "evidence_status": "pending",
      "severity": "critical",
      "decision": "needs_review",
      "revision_action": "商品白底图、佩戴或固定方式图、户外运动场景样片、移动端 App 剪辑界面截图均在 asset_dependency_map 中保留授权/审核要求；未见有效素材授权，因此不能标记为 resolved。",
      "release_gate_effect": {
        "structured_planning_package": "needs_review",
        "growth_evaluation": "approved_for_evaluation_only",
        "final_marketing_copy": "blocked",
        "final_image_prompt": "blocked",
        "image_generation": "blocked",
        "frontend_page": "blocked",
        "public_release": "blocked"
      },
      "human_review_required": true
    },
    {
      "compliance_run_id": "brief_demo_action_camera_001::brand_compliance::post_generation_check::001",
      "mode": "post_generation_check",
      "trace_id": "brief_demo_action_camera_001::two_stage_compliance",
      "risk_id": "risk_logo_portrait_and_scene_materials_need_rights_clearance",
      "risk_type": "asset_authorization",
      "source_artifact": "outputs/image_prompt_pack_outline.json",
      "source_json_pointer": "/data/forbidden_elements/0",
      "evidence_status": "pending",
      "severity": "critical",
      "decision": "needs_review",
      "revision_action": "视觉方案禁止真实品牌 Logo、未经授权名人形象和竞品攻击，但仅禁止或等待审核不等于已获得授权；Logo、人物肖像、真实品牌元素和场景素材仍需权利清理。",
      "release_gate_effect": {
        "structured_planning_package": "needs_review",
        "growth_evaluation": "approved_for_evaluation_only",
        "final_marketing_copy": "blocked",
        "final_image_prompt": "blocked",
        "image_generation": "blocked",
        "frontend_page": "blocked",
        "public_release": "blocked"
      },
      "human_review_required": true,
      "related_visual_pointer": "/data/visual_risk_register/4"
    },
    {
      "compliance_run_id": "brief_demo_action_camera_001::brand_compliance::post_generation_check::001",
      "mode": "post_generation_check",
      "trace_id": "brief_demo_action_camera_001::two_stage_compliance",
      "risk_id": "risk_forbidden_expression_competitor_and_negative_constraints",
      "risk_type": "forbidden_expression",
      "source_artifact": "outputs/creative_copy_pack_outline.json",